<?xml version="1.0"?>
<school xmlns:xsi="http://www.w3.org/2001/XMLSchema-instance" xsi:noNamespaceSchemaLocation="database_subjects.xsd">
  <subject name="Mathematik">
    <enrolledStudents>
      <student id="3">
        <grade date="2022-03-07">
          <mark>5.5</mark>
          <feedback>Sehr gut</feedback>
        </grade>
        <grade date="2022-02-28">
          <mark>4.5</mark>
          <feedback>Gen&#xFC;gend</feedback>
        </grade>
        <grade date="2022-03-14">
          <mark>4</mark>
          <feedback>Gen&#xFC;gend</feedback>
        </grade>
      </student>
      <student id="0">
        <grade date="2022-03-07">
          <mark>5.5</mark>
          <feedback>Sehr gut</feedback>
        </grade>
        <grade date="2022-03-01">
          <mark>5</mark>
          <feedback>Gut</feedback>
        </grade>
        <grade date="2022-02-01">
          <mark>5</mark>
          <feedback>Gut</feedback>
        </grade>
      </student>
      <student id="1">
        <grade date="2022-03-14">
          <mark>4</mark>
          <feedback>Gen&#xFC;gend</feedback>
        </grade>
        <grade date="2022-03-11">
          <mark>5</mark>
          <feedback>Gut</feedback>
        </grade>
      </student>
      <student id="2">
        <grade date="2022-02-05">
          <mark>5.5</mark>
          <feedback>Sehr gut</feedback>
        </grade>
        <grade date="2022-03-07">
          <mark>5.5</mark>
          <feedback>Sehr gut</feedback>
        </grade>
        <grade date="2022-03-01">
          <mark>5</mark>
          <feedback>Gut</feedback>
        </grade>
      </student>
      <student id="4">
        <grade date="2022-02-01">
          <mark>3</mark>
          <feedback>Ungen&#xFC;gend</feedback>
        </grade>
        <grade date="2022-03-07">
          <mark>5.5</mark>
          <feedback>Sehr gut</feedback>
        </grade>
        <grade date="2022-03-01">
          <mark>5</mark>
          <feedback>Gut</feedback>
        </grade>
      </student>
    </enrolledStudents>
  </subject>
  <subject name="Franz&#xF6;sisch">
    <enrolledStudents>
      <student id="0">
        <grade date="2022-02-02">
          <mark>5.5</mark>
          <feedback>Sehr gut</feedback>
        </grade>
        <grade date="2022-03-07">
          <mark>5.5</mark>
          <feedback>Sehr gut</feedback>
        </grade>
        <grade date="2022-03-01">
          <mark>5</mark>
          <feedback>Gut</feedback>
        </grade>
      </student>
      <student id="1">
        <grade date="2022-02-02">
          <mark>5</mark>
          <feedback>Gut</feedback>
        </grade>
        <grade date="2022-03-07">
          <mark>5</mark>
          <feedback>Gut</feedback>
        </grade>
        <grade date="2022-03-09">
          <mark>5</mark>
          <feedback>Gut</feedback>
        </grade>
      </student>
      <student id="4">
        <grade date="2022-03-14">
          <mark>3</mark>
          <feedback>Ungen&#xFC;gend</feedback>
        </grade>
        <grade date="2022-03-12">
          <mark>5</mark>
          <feedback>Gut</feedback>
        </grade>
      </student>
      <student id="2">
        <grade date="2022-02-05">
          <mark>4</mark>
          <feedback>Gen&#xFC;gend</feedback>
        </grade>
        <grade date="2022-03-07">
          <mark>5.5</mark>
          <feedback>Sehr gut</feedback>
        </grade>
        <grade date="2022-03-01">
          <mark>5</mark>
          <feedback>Gut</feedback>
        </grade>
      </student>
    </enrolledStudents>
  </subject>
  <subject name="Italienisch">
    <enrolledStudents>
      <student id="3">
        <grade date="2022-03-14">
          <mark>4</mark>
          <feedback>Gen&#xFC;gend</feedback>
        </grade>
        <grade date="2022-03-13">
          <mark>4.5</mark>
          <feedback>Gen&#xFC;gend bis gut</feedback>
        </grade>
      </student>
      <student id="2">
        <grade date="2022-02-05">
          <mark>4.5</mark>
          <feedback>Gen&#xFC;gend bis gut</feedback>
        </grade>
        <grade date="2022-03-14">
          <mark>4</mark>
          <feedback>Gen&#xFC;gend</feedback>
        </grade>
      </student>
    </enrolledStudents>
  </subject>
  <subject name="Gymnastik">
    <enrolledStudents>
      <student id="3">
        <grade date="2022-02-01">
          <mark>3.5</mark>
          <feedback>Ungen&#xFC;gend</feedback>
        </grade>
        <grade date="2022-03-14">
          <mark>4</mark>
          <feedback>Gen&#xFC;gend</feedback>
        </grade>
        <grade date="2022-03-13">
          <mark>4.5</mark>
          <feedback>Gen&#xFC;gend bis gut</feedback>
        </grade>
      </student>
      <student id="0">
        <grade date="2022-03-14">
          <mark>4</mark>
          <feedback>Gen&#xFC;gend</feedback>
        </grade>
        <grade date="2022-03-13">
          <mark>5</mark>
          <feedback>Gut</feedback>
        </grade>
        <grade date="2022-03-11">
          <mark>5</mark>
          <feedback>gut</feedback>
        </grade>
        <grade date="2022-03-10">
          <mark>6</mark>
          <feedback>super</feedback>
        </grade>
      </student>
      <student id="2">
        <grade date="2022-02-05">
          <mark>5.5</mark>
          <feedback>Sehr gut</feedback>
        </grade>
      </student>
      <student id="4">
        <grade date="2022-03-07">
          <mark>6</mark>
          <feedback>Hervorragend</feedback>
        </grade>
        <grade date="2022-03-14">
          <mark>4</mark>
          <feedback>Gen&#xFC;gend</feedback>
        </grade>
        <grade date="2022-03-13">
          <mark>4.5</mark>
          <feedback>Gen&#xFC;gend bis gut</feedback>
        </grade>
      </student>
    </enrolledStudents>
  </subject>
  <subject name="Zeichnen">
    <enrolledStudents>
      <student id="3">
        <grade date="2022-03-13">
          <mark>4</mark>
          <feedback>Gen&#xFC;gend</feedback>
        </grade>
        <grade date="2022-03-14">
          <mark>5</mark>
          <feedback>Gut</feedback>
        </grade>
        <grade date="2022-03-12">
          <mark>5</mark>
          <feedback>gut</feedback>
        </grade>
      </student>
      <student id="2">
        <grade date="2022-02-05">
          <mark>4.5</mark>
          <feedback>Gen&#xFC;gend bis gut</feedback>
        </grade>
        <grade date="2022-03-14">
          <mark>4</mark>
          <feedback>Gen&#xFC;gend</feedback>
        </grade>
        <grade date="2022-03-13">
          <mark>4.5</mark>
          <feedback>Gen&#xFC;gend bis gut</feedback>
        </grade>
      </student>
      <student id="0">
        <grade date="2022-02-02">
          <mark>4.5</mark>
          <feedback>Gen&#xFC;gend bis gut</feedback>
        </grade>
        <grade date="2022-03-14">
          <mark>4</mark>
          <feedback>Gen&#xFC;gend</feedback>
        </grade>
        <grade date="2022-03-13">
          <mark>4.5</mark>
          <feedback>Gen&#xFC;gend bis gut</feedback>
        </grade>
      </student>
      <student id="1">
        <grade date="2022-03-14">
          <mark>3</mark>
          <feedback>Ungen&#xFC;gend</feedback>
        </grade>
        <grade date="2022-03-13">
          <mark>5</mark>
          <feedback>Gut</feedback>
        </grade>
        <grade date="2022-03-16">
          <mark>5</mark>
          <feedback>Gut</feedback>
        </grade>
      </student>
      <student id="4">
        <grade date="2022-03-14">
          <mark>3</mark>
          <feedback>Ungen&#xFC;gend</feedback>
        </grade>
        <grade date="2022-03-13">
          <mark>5</mark>
          <feedback>Gut</feedback>
        </grade>
        <grade date="2022-03-15">
          <mark>4</mark>
          <feedback>Gen&#xFC;gend</feedback>
        </grade>
      </student>
    </enrolledStudents>
  </subject>
</school>
